{
  "tia_schema_version": "1.0",
  "cover": {
    "tia_ref": "TIA-US-2026-001",
    "title": "US transfer — payroll processor",
    "org_slug": "acme-gmbh",
    "assessor": "J. Doe (Privacy Counsel)",
    "date": "2026-08-01"
  },
  "transfer_qualification": {
    "criterion_1": {"met": true, "note": "Exporter established in DE, Art. 3(1)."},
    "criterion_2": {"met": true, "note": "Disclosure to a separate US processor."},
    "criterion_3": {"met": true, "note": "Importer located in the US."},
    "failing_criterion": null
  },
  "step1": {
    "exporter": "Acme GmbH",
    "importer": "Payrollix Inc.",
    "roles": "controller -> processor",
    "destination_country": "US",
    "importer_sector": "HR / payroll SaaS",
    "data_categories": ["employee master data", "salary data"],
    "data_subjects": ["employees"],
    "purpose": "payroll processing",
    "volume": "approx. 1200 records",
    "frequency": "monthly",
    "formats": ["TLS-encrypted in transit", "encrypted at rest (importer keys)"],
    "onward_transfers": {"present": "no", "child_assessment_ref": null}
  },
  "step2": {
    "mechanism": "sccs",
    "adequacy": null,
    "art49": null,
    "dpf_reliance": null
  },
  "step3": {
    "conclusion": "2",
    "justification": "FISA 702 exposure for a cloud provider handling EU payroll data; Block B concerns on redress despite EO 14086.",
    "block_b_guarantees": {
      "legality_clarity": "concerns",
      "necessity_proportionality": "adequate",
      "oversight": "adequate",
      "redress": "concerns"
    }
  },
  "step4": {
    "measures": [
      {
        "type": "technical",
        "addresses_gap": "Importer cannot produce intelligible data under a FISA 702 directive: exporter-held keys.",
        "implementation_status": "implemented",
        "effectiveness": "effective"
      }
    ],
    "overall_effectiveness": "sufficient",
    "decision": "proceed"
  },
  "step5_6": {
    "next_review_date": "2027-08-01",
    "sign_off": {
      "assessor": {"name": "J. Doe", "date": "2026-08-01"},
      "dpo": {"name": "M. Muster", "date": "2026-08-02"}
    }
  },
  "ropa_delta": {"emitted": false, "delta_ref": null},
  "overrides": [],
  "validation": {"status": "passed", "findings": []}
}
